{
  "tile_type": "GAVEL_GRIFTER",
  "official_name_as_published": "FIXTURE.BJS.PUBLIC.REPRIMAND.PLACEHOLDER",
  "bjs_public_hit": true,
  "replay_note": "Public reprimand page exists. Underlying investigation file is not fully remote. No wrongdoing inference.",
  "wrongdoing_inference": false,
  "existence_state": "EXIST_PUBLIC",
  "access_state": "REMOTE_PARTIAL",
  "cause_state": "PARTIALLY_REPLAYABLE",
  "full_replay_checklist": {
    "case_number": true,
    "parties": false,
    "charges": false,
    "procedural_history": false,
    "disposition": true,
    "judge_name": true,
    "written_opinion": false,
    "final_order": true
  },
  "promotion_receipt": {
    "source_url": "https://www.bjs.state.mn.us/discipline",
    "quoted_phrase": "Public reprimands issued by the Board are also public."
  },
  "pipeline_stage": 1,
  "source_system": "BJS_PUBLIC"
}
