{
  "tile_type": "BJS_PRIVATE_AGGREGATE",
  "official_name_as_published": null,
  "bjs_public_hit": false,
  "replay_note": "Annual-report private-discipline count only. Countable, not identifiable. No named officeholder.",
  "wrongdoing_inference": false,
  "existence_state": "EXIST_CONFIDENTIAL",
  "access_state": "REMOTE_NO",
  "cause_state": "CONFIDENTIAL_BY_RULE",
  "full_replay_checklist": {
    "case_number": false,
    "parties": false,
    "charges": false,
    "procedural_history": false,
    "disposition": false,
    "judge_name": false,
    "written_opinion": false,
    "final_order": false
  },
  "promotion_receipt": {
    "source_url": "https://www.bjs.state.mn.us/private-discipline-summaries",
    "quoted_phrase": "Admonitions are not public."
  },
  "pipeline_stage": 2,
  "source_system": "BJS_PRIVATE_AGGREGATE"
}
